{
  "$schema": "http://json-schema.org/draft-07/schema#",
  "$id": "https://github.com/alibnali/ADAM/schemas/ClarificationQuestion.json",
  "title": "ClarificationQuestion",
  "description": "A structured question ADAM asks the engineer when a mandatory input is missing or ambiguous.",
  "type": "object",
  "required": ["question_id", "field", "question", "source", "priority", "blocking"],
  "additionalProperties": false,
  "properties": {
    "question_id":    { "type": "string", "pattern": "^CLQ-[A-Z0-9_-]+$" },
    "field":          { "type": "string" },
    "question":       { "type": "string" },
    "hint":           { "type": "string" },
    "example":        {},
    "expected_type":  { "type": "string", "enum": ["number", "string", "boolean", "object", "array"] },
    "expected_unit":  { "type": "string" },
    "valid_range": {
      "type": "object",
      "properties": {
        "min": { "type": "number" },
        "max": { "type": "number" }
      }
    },
    "source": {
      "type": "string",
      "enum": ["input_normalizer", "structural_engine", "civil_engine", "mep_engine", "drawing_engine", "orchestrator"]
    },
    "priority":   { "type": "integer", "minimum": 1 },
    "blocking":   { "type": "boolean" },
    "depends_on": { "type": "array", "items": { "type": "string" } }
  }
}
